agency_id,agency_title,agency_status,location,agency_start,agency_end,function_start,function_end
CA 8601,Institute of Physical Sciences,Head Office,Australian Capital Territory,1978-12-15,1988-01-01,1978-12-15,1988-01-01
CA 8624,"CSIRO, Division of Exploration and Mining, Pinjarra Hills [Queensland]",Local Office,Queensland,1993-07-01,,1993-07-01,
CA 8625,"CSIRO, Fodder Conservation Section, Highett [Victoria]",Local Office,Victoria,1945-07-02,1967-06-20,1945-07-02,1967-06-20
CA 8926,Food Science Australia,Regional or State Office,New South Wales,1997-12-01,2009-07-01,1997-12-01,2006-07-01
CA 8960,"CSIRO, Health Sciences and Nutrition",Head Office,"South Australia, Victoria",1999-07-05,2005-07-01,1999-07-05,2005-07-01
CA 8969,"CSIRO, Sustainable Ecosystems, Western Australia",Regional or State Office,Western Australia,2000-10-03,,2000-10-03,
CA 9077,"CSIRO, Australia Telescope National Facility",Local Office,New South Wales,1988-01-01,,1988-01-01,
CA 9100,"CSIRO, Division of Marine and Atmospheric Research (CMAR)",Head Office,Tasmania,2005-07-01,,2005-07-01,
CA 9102,"CSIRO, Manufacturing & Infrastructure Technology [CMIT], Head Office",Head Office,Victoria,,,2002-07,
CA 9103,"CSIRO, Manufacturing & Infrastructure Technology [CMIT], New South Wales",Local Office,New South Wales,,,2002,
CA 9105,"CSIRO, Division of Manufacturing Science and Technology, Head Office",Head Office,Victoria,1997,,1997,2002-07
CA 9108,"National Building Technology Centre, Head Office",Head Office,New South Wales,1985-05-16,1988-07-01,1985-05-16,1988-07-01
CA 9113,"CSIRO, Sustainable Ecosystems, Head Office",Head Office,Australian Capital Territory,2000-10-03,,2000-10-03,
CA 9165,Director of National Parks,Head Office,Australian Capital Territory,2000-07-16,,2000-07-16,
CA 9186,"Department of Innovation, Industry, Science and Research, Central Office",Department of State,Australian Capital Territory,2007-12-03,2011-12-14,2007-12-03,2011-12-14
CA 9189,"Department of Climate Change, Central Office",Head Office,Australian Capital Territory,2007-12-03,2010-03-08,2007-12-03,2010-03-08
CA 9310,"Department of Climate Change and Energy Efficiency, Central Office",Department of State,Australian Capital Territory,2010-03-08,2013-03-25,2010-03-08,2013-03-25
CA 9337,"Ausindustry, Northern Territory Regional Office",Regional or State Office,Northern Territory,2007-12-03,,2007-12-03,
CA 9341,"CSIRO, Division of Livestock Industries, Brisbane [Queensland]",Head Office,Queensland,2000-07-01,,2000-07-01,
CA 9355,"AusIndustry, South Australia State Office",Regional or State Office,South Australia,2007-12-03,,2007-12-03,
CA 9357,"CSIRO, Food and Nutritional Sciences",Head Office,New South Wales,2009-07-01,,2009-07-01,
CA 9358,"CSIRO, Molecular and Health Technologies",Head Office,Victoria,2005-07-01,,2005-07-01,
CA 9363,"AusIndustry, Tasmania State Office",Regional or State Office,Tasmania,2007-12-03,,2007-12-03,
CA 9382,"Department of Industry, Innovation, Science, Research and Tertiary Education, Central Office",Department of State,Australian Capital Territory,2011-12-14,2013-03-25,2011-12-14,2013-03-25
CA 9387,Australian Bureau of Agricultural and Resource Economics and Sciences,Head Office,Australian Capital Territory,2010-10-14,,2010-10-14,
CA 9438,"Department of the Environment [III], Central Office",Department of State,Australian Capital Territory,2013-09-18,,2013-09-18,
CA 9439,"Prime Minister's Science, Engineering and Innovation Council",Head Office,Australian Capital Territory,1989,,1989,
